cleaned_review,standardized_date,cleaned_rating,Restaurant,Address,sentiment_score,sentiment
we got this delivered to our house in washington dc we went to texas last week and wanted to try this place however we heard that the line was very long and we didnt have time to do that so we ordered it to deliver to our house it took about a week to get what we ordered and we were very happy with them we got a brisket sausages and a barbecue sauce the package was still cold when delivered everything was delicious their barbecue sauce was amazing,2024-08-31,4.7,Franklin Barbecue,"900 E 11th St, Austin, TX 78702, USA",0.9099,Positive
"100100 hands down the best bbq in the country we have explored a lot and we would wait again for 4 hours to eat here we arrived at 7 am on a tuesday morning  we were the first in the parking lot but when we got to the line 4 others had beaten us there
brisket ribs and turkey were like no other the sausage was good and cant forget the pulled pork the spicy bbq sauce is the best
next time i wouldnt get any sides we tried them all but when the meat is so good you dont even need them
and dont forget the bourbon banana pie 
we are from out of state and got a brisket to take home to our friends its vacuum sealed
yes this place is worth the trip price and wait",2024-09-24,4.7,Franklin Barbecue,"900 E 11th St, Austin, TX 78702, USA",0.9796,Positive
franklin barbecue truly lives up to the hype the brisket was meltinyourmouth tender with a perfect smoky flavor that made it absolutely worth the wait the ribs and sausage were equally impressive each bite packed with rich savory goodness the sides especially the potato salad and coleslaw were fresh and paired beautifully with the meats the staff was friendly and kept the line moving smoothly if youre a barbecue lover franklin barbecue is a mustvisit its an experience you wont forget,2024-09-02,4.7,Franklin Barbecue,"900 E 11th St, Austin, TX 78702, USA",0.9853,Positive
"going to franklin takes a level of commitment that a platter of barbecued meats cant generally command and yet day after day throngs of people arrive hours before it opens in order to line up and grab a pound of brisket before they sell out they always sell out so that should tell you all you need to know about how good the food is

instead ill offer you these tips that i gathered from my three hours queuing and fifteen minutes of eating at franklin one sunday in september

 we arrived an hour before opening and wished wed made it thirty minutes before as we narrowly missed the area in the line that was shaded from the sun whenever youre thinking of getting there aim for thirty minutes before then youll inevitably be glad you did
 bring a bottle of water a portable charger for your phone and something to read or listen to
 the brisket beef rib when available and pork rib are in my opinion the must order items
 the sides are nothing to write home about and can easily be ignored without missing out on anything
 you can go in the middle door to the lobby and buy beers or soft drinks and bring them back to your spot in the line delighting your friends with your ingenuity and generosity

franklin is worth it  honestly  but preparing for the experience with military precision can eliminate some of the annoying friction of it",2024-09-22,4.7,Franklin Barbecue,"900 E 11th St, Austin, TX 78702, USA",0.6902,Positive
"without a doubt the greatest of all time

believe the hype dig the craft drink the beer eat the bbq live the dream

transformative slow smoked meats brisket is truly the finest in the world turkey will blow your mind the sausages are exceptional and unique",2024-09-17,4.7,Franklin Barbecue,"900 E 11th St, Austin, TX 78702, USA",0.3903,Positive
i cannot share enough good things about this amazing hotel it was the absolutely perfect spot for a little getaway from my husband and our baby the staff was so kind and accommodating from texts ahead of time to make sure we had everything we needed to even upgrading us to an incredible room by the pool the location could not get any better on south congress the pool was great the room was clean and spacious and perfectly styled and detailed the bed was very comfortable and the ac worked wonderfully the free cold water and free coffee was a great touch i love the calm relaxing aesthetic of every part of this hotel we loved it so much they allowed us to check in to our room early and they even let us keep our car there for a couple hours after we checked out so we could go to lunch i will highly recommend this to anyone i know visiting austin,2024-06-10,4.7,Hotel San José,"1316 S Congress Ave, Austin, TX 78704, USA",0.9954,Positive
"we came to austin for a quick girls weekend and really enjoyed our stay at hotel san jose the staff were very helpful and friendly the vibe overall was great we loved the design and decor of the property and our room the beds were comfy we liked the linens and the robes were so cute we also appreciated the ceiling fan in our room we enjoyed the location and close proximity to a lot of restaurants and shopping and it was fairly walkable were all city girls and are up for a decent walk to get places to different attractions the street in front of the hotel is pretty busy but our room was at the back of the property and very quiet it was pretty hot and humid during our stay so the pool was a perfect way to cool off in the afternoons it was also just a great area to lounge outside of your room the courtyard bar area seemed to be a hangout for both guests and folks not staying at the hotel so it was lively in a good way they also had breakfast tacos on saturday morning that were delicious there is a coffee shop nextdoor that is affiliated with the hotel so that was great for a quick drinkbite in the morning

my only real complaint was that the only mirror in the room was in the bathroom area it would be nice to have another mirror ideally full length in the main room area to make it easier for several people to get ready at the same time

note  the area can be a little buggy generally if you are sensitive to mosquitoes consider bringing bug spray",2024-05-28,4.7,Hotel San José,"1316 S Congress Ave, Austin, TX 78704, USA",0.9972,Positive
we stayed here for a girls trip and it was absolute perfection the staff were so generous and kind rooms were very spacious and we loved the lounge and pool to spend time together as group you truly forget you are on bustling south congress because the grounds are so lush and filled with birds we booked the adjoining courtyard king rooms to allow for space for five and it was perfect for a group staying together the balconies overlooking the lounge felt so special absolutely will visit again,2024-04-18,4.7,Hotel San José,"1316 S Congress Ave, Austin, TX 78704, USA",0.979,Positive
we love staying at hotel san jose immaculate vibes insanely good location and great service tiffany went above and beyond to make sure we were having fun and were taken care of we will definitely be back,2024-09-16,4.7,Hotel San José,"1316 S Congress Ave, Austin, TX 78704, USA",0.9709,Positive
10000010 place couldnt recommend enough i booked this place in may for my sisters college graduation unfortunately i had one of the worst travel days of my life that had me coming in for 12 hours later than what i was supposed to because of that i probably spent 8 hours total at the place and they went above and beyond for me and my sister they gave us free champagne because i was keeping them up to date on my travels some cute lil goodies for us and a beautiful hand written note letting us know those things were on the house and they were so sorry about my travel day amazing staff excellent communication beautiful hotel and really great location to go bop around i will always stay at this hotel when i come to austin you guys are the best and should have a 55 on google for how well you treat your guests thank you,2024-07-04,4.7,Hotel San José,"1316 S Congress Ave, Austin, TX 78704, USA",0.9867,Positive
ate dinner here the other night got the stubbs minor plate with brisket and sausage brisket was a little cold and mostly fat my server was very friendly and knowledgeable as well as the rest of the staff i interacted with wish the food was a little better but ill definitely try this place again,2024-09-18,4.3,Stubb's Bar-B-Q,"801 Red River St, Austin, TX 78701, USA",0.6903,Positive
hey so we stopped at stubbs barbq and it was totally worth it the place has a really cool vibe the restaurant and a small bar are on the first floor and then downstairs they have a concert area and another bar the staff was super friendly and quick with our orders the food was amazing we got the pulled pork sandwich with mac and cheese and fries on the side the mac and cheese was bomb we also ordered the threemeat sampler with brisket pulled pork and ribs the ribs were my favorite we also got some cornbread and fried okra which were both really good well definitely be going back,2024-08-17,4.3,Stubb's Bar-B-Q,"801 Red River St, Austin, TX 78701, USA",0.9676,Positive
i went for lunch alone it was not crowded around 12pm but it was getting busier after 1230pm i am not much a fan of red meat take my review as a grain of salt i ordered ribs it was tender but a little bit salty to me i usually eat plain fried okra was good not too dry this place is good for family hangout they have many big tables and great deal for a group i heard they have evening show is hosted at basement everyone is friendly and attentive,2024-03-30,4.3,Stubb's Bar-B-Q,"801 Red River St, Austin, TX 78701, USA",0.9494,Positive
parking was difficult to find along the road and some guy came up to ask for money while we were unloading  we had to wait about 20 mins downstairs for our table which ended up fine because we were able to explore a couple of their music stages down there  the service staff were friendly and the atmosphere felt historical or old in some way  the food was good though pricey heavy and a bit greasy  not sure wed come back next time around,2024-04-18,4.3,Stubb's Bar-B-Q,"801 Red River St, Austin, TX 78701, USA",0.5327,Positive
the place is laid back almost like a time warp back to simpler times food is good but getting parking can be a bit of a hassle so plan accordingly staff is great and attentive ask for bathroom directions as you walk in and you wont get lost they can just point it out to you they are in the basement and you have to make many turns to get there,2024-04-10,4.3,Stubb's Bar-B-Q,"801 Red River St, Austin, TX 78701, USA",0.8921,Positive
delicious food friendly service massive quantity i finished a fourth of the plate we had the pork chop chicken  waffles old fashioned shrimp corn dogs corn bread popcorn the food was amazing there is an outside area with fans and mist for hot days,2024-09-25,4.6,Moonshine Grill,"303 Red River St, Austin, TX 78701, USA",0.8934,Positive
loved the atmosphere as it was in an old house on a nondescript street in austin texas service was great attentive but not over bearing the food id say the food vibe is elevated comfort foodwas good but not delicious my favorite thing was the free popcorn they bring to your table quite tasty my cocktail a blind mule was quite yummy i would go back but i wouldnt rush back,2024-07-09,4.6,Moonshine Grill,"303 Red River St, Austin, TX 78701, USA",0.8962,Positive
i was visiting austin with my friend and we went here 3 times during our 4 day stay so it is safe to say that we thoroughly loved it here the food service and atmosphere were all excellent i loved the unique touch of having complimentary popcorn during our visits we tried the hangar steak rainbow trout blackened catfish pork ribs and chicken almondine every dish was a hit all of the staff were amazing but especially cassie who had excellent recommendations to really sell the menu it was great to see the staff helping each other out and making the service so seamless they also offered a complimentary dessert to celebrate my friends birthday,2024-08-15,4.6,Moonshine Grill,"303 Red River St, Austin, TX 78701, USA",0.9916,Positive
went for two different mixers and the portions were huge i got the pork ribs and it was a lot in a great way the corn dog shrimp is genius sweet potato tots were great loved the key lime pie,2024-08-12,4.6,Moonshine Grill,"303 Red River St, Austin, TX 78701, USA",0.9545,Positive
weve been to their avery location but never the original one downtown here we are in the patio bar area the guys there charles and sean were so nice it was me and my husbands wedding anniversary they made it such a pleasant experience i had the rainbow trout and he had the pork chop super tasty it was about a 25min wait upstairs so we just ate at the bar there its in a historic building gorgeous old features and hardwood floors would definitely recommend,2024-08-13,4.6,Moonshine Grill,"303 Red River St, Austin, TX 78701, USA",0.981,Positive
"feelgood tunes and balanced mix of open air and air conditioned seating available we came toward the end of the night and were seated inside right away happy hour is from 430  630 pm daily and can get busy our server tarah was exceptional and recommended the daily special which was from spain and was the most lean and tender pork seared to perfection we tried some of their classics as well deviled eggs duck fat fries biscuits and werent disappointed cocktails were refreshing too particularly in to the wild similar to a cherry limeade and the mocktail veto mango fizz
they do not offer a military discount they have a parking lot and street parking well be back again and bringing friends",2024-08-10,4.6,Salty Sow,"1917 Manor Rd, Austin, TX 78722, USA",0.9528,Positive
"the appetizers were my favorite im torn between the truffled deviled eggs and duck fat fries the biscuit has the best airy butter too for the main we got pork belly tips with cheese grits that had a great flavor we sat outside with our dog and they were all so sweet to her
and they had some great wine options too",2024-08-31,4.6,Salty Sow,"1917 Manor Rd, Austin, TX 78722, USA",0.9491,Positive
yall this food is delicious ive been going to salty sow for years and it never disappoints everything tastes so good and is consistently one of the best meals ive ever had in austin tonight i got it delivered and was so impressed that the quality of the food held up they even managed to still have decent presentation with sustainable packaging for delivery,2024-07-23,4.6,Salty Sow,"1917 Manor Rd, Austin, TX 78722, USA",0.9572,Positive
the redfish is especially good enough to justify a double serving  everything came with hearty portions and was very flavourful the sides especially the brussels stood out for starters the french fries and the chicken pate were excellent and the main courses paired very well with the biscuits the atmosphere was warm and welcoming much like the food,2024-08-16,4.6,Salty Sow,"1917 Manor Rd, Austin, TX 78722, USA",0.9391,Positive
"salty sow is a really nice place with a beautiful decor that make you feel super relaxed we went during happy hour and it was crowded with people constantly coming in which is a great sign we didnt have to wait long to be seated and once we were the service was friendly and super quick

happy hour dishes were really tasty though the portions were a bit small overall it was a good experience",2024-03-26,4.6,Salty Sow,"1917 Manor Rd, Austin, TX 78722, USA",0.9887,Positive
violet crown cinema is an iconic and unique escape in downtown austin offering a clean and cozy atmosphere perfect for quality films the incredibly friendly bartender crafted a solid spicy margarita adding to the delightful experience with good parking options and validation convenience is a plus while theres always room for a bit more magic its definitely a mustvisit for film enthusiasts,2024-07-20,4.5,Violet Crown Cinema,"434 W 2nd St, Austin, TX 78701, USA",0.9728,Positive
its been a while since ive been here but i went last night good drink selection used to have better soft drinks now its just coke products boo pizza is new and thats nice good theatre setup very modern but somewhat spartan im okay with that they show more interesting films than mainstream theatres,2024-09-25,4.5,Violet Crown Cinema,"434 W 2nd St, Austin, TX 78701, USA",0.969,Positive
a cool and funky small theater in west downtown near a bunch of good restaurants they tend to have a good selection of eclectic films and it is generally not busy during the day on weekdays they provide 4 hours of free parking,2024-08-28,4.5,Violet Crown Cinema,"434 W 2nd St, Austin, TX 78701, USA",0.875,Positive
my favorite movie theater in town small theaters with comfortable seats great staff cocktails and lounge limited kitchen great place to see arts movies and the latest releases in a cool environment on a hot day order tickets online park free in garage always a treat,2023-07-08,4.5,Violet Crown Cinema,"434 W 2nd St, Austin, TX 78701, USA",0.9678,Positive
great venue for those interested in independent movies an amazing modern and cozy environment their food is great and have a good selection of wine beer and cocktails the only issue i have is that they dont bring food to your seat you can only buy it beforehand and bring it in,2022-09-17,4.5,Violet Crown Cinema,"434 W 2nd St, Austin, TX 78701, USA",0.9559,Positive
this place has an authentic austin feel mix of western and modern the staff is very friendly and professional the food is all great havent had a dish i didnt like we had the queso hanger steak and beef brisket all very juicy and full of flavor the drinks are good too  not a bunch of crushed ice you actually get alcohol they have live music upstairs,2024-09-26,4.4,Lamberts,"401 W 2nd St, Austin, TX 78701, USA",0.8937,Positive
i enjoyyyyedd so much going to lamberts for my first meal in austin i found the place a little bit by chance and i was highly satisfied by the service i was taken care of by will i loved his energy and professionalism food was also great i had the 3 meats plate it was heavy  as expected  i also had an old fashion that i liked very much would definitely recommend ,2024-08-28,4.4,Lamberts,"401 W 2nd St, Austin, TX 78701, USA",0.9761,Positive
"i loved lamberts lunch of brisket sandwich and cashew lime coleslaw each of the few ingredients of the sandwich are harmonies without seeming overwrought both their red and mustard sauces are an excellent compliment to their brisket without insisting on themselves
after lamberts its fun to visit toy joy to shop joes for coffee or the riverside trail to walk off your meal",2024-09-08,4.4,Lamberts,"401 W 2nd St, Austin, TX 78701, USA",0.9643,Positive
"miami resident and huge bbq fan also come to austin often

miami friends recommended and boy were they right

amazing brisket and mac and cheese

highly recommend",2024-09-17,4.4,Lamberts,"401 W 2nd St, Austin, TX 78701, USA",0.9336,Positive
"lamberts is a great barbecue place if you are in the area the crispy wild boar ribs wer6e very flavorful and had somewhat of an asian influence i would definitely highly recommend this appetizer to start with i had the two meat plate which i would say is good the brisket was lean meaty and somewhat tender if youre looking for extra moist brisket this is not it however the flavor was good and the sides that i got were collard greens and coleslaw both of these sides were not bad

i really enjoyed that the table came with three different sauces my favorite probably was the mustard and then the hot and then the house i saw some of my coworkers really lather their barbecue with the house sauce so that might say something about it it was a little bit vinegary for me however thats not a bad thing

i would say that if youre in the area and craving bbq this is not a bad place to go with me living up north i would not make a specific trip to come here as it would be a little bit out of my way",2024-04-12,4.4,Lamberts,"401 W 2nd St, Austin, TX 78701, USA",0.972,Positive
vibe check and its perfect happy eclectic full house and the best salsa  the food was good i loved the service they were kind enough to suggest great vegetarian options the live music is scheduled few days a week and its must drink options are great especially margaritas,2024-08-30,4.2,Güero's Taco Bar,"1412 S Congress Ave, Austin, TX 78704, USA",0.9849,Positive
"very delicious food the mole enchiladas were awesome  fajita salad was well served and delicious margaritas were tasty and the salsas were very good my favorite while in austin

the flautas are classics and delicious as well so many delicious choices to choose from and never disappoints

cant wait to go back again for this special treat",2024-06-15,4.2,Güero's Taco Bar,"1412 S Congress Ave, Austin, TX 78704, USA",0.9897,Positive
"this place was great we read that sometimes people can wait hours for a table but we were able to show up and get seated right away

the free chips and assortment of salsas was great as well as the meal itself oh and dont forget the margarita",2024-06-07,4.2,Güero's Taco Bar,"1412 S Congress Ave, Austin, TX 78704, USA",0.9538,Positive
a charming destination for dinner offering a plethora of options particularly for enthusiasts of mexican cuisine the staff is warm and welcoming creating a delightful atmosphere our experience indulging in the flavorsome tacos and tamales left us thoroughly satisfied,2024-03-31,4.2,Güero's Taco Bar,"1412 S Congress Ave, Austin, TX 78704, USA",0.9605,Positive
great service courteous and professional food hot and fast beer cold great vibes the girls from deathproof would approve,2024-09-27,4.2,Güero's Taco Bar,"1412 S Congress Ave, Austin, TX 78704, USA",0.91,Positive
we knew about uchi because its supposed to be the best restaurant in austin a special occasion came up so we visited on a saturday night i am pleased to report it blew us away its rare to have an eating experience unlike any youve had before the dishes were perfectly prepared  particularly the sauces what stood out most to me were the flavors exquisitely crafted and balanced im not a big raw fish fan but i enjoyed everything i ate the service was also quite good we mentioned our special occasion and the server brought us a really good trout dish on the house complimentary valet parking was nice too definitely will be going back and couldnt be happier with our experience,2024-09-29,4.7,Uchi Austin,"801 S Lamar Blvd, Austin, TX 78704, USA",0.9873,Positive
great interesting sushi and japanese inspired dishes very flavorful beautiful presentations excellent na and alcoholic drinks our server stephanie was a blast great date night,2024-09-24,4.7,Uchi Austin,"801 S Lamar Blvd, Austin, TX 78704, USA",0.9719,Positive
always a complete pleasure eating here   service and atmosphere are as expected   the food never disappoints   my cold sake was creamy and refreshing   the wagyu carpacio is delicious  i tried all three of the market selection and all 3 were amazing   the grilled fish appetizer is stupid good  with perfect texture and flavor   the scallop bites are always super fresh and bright  the tuna hand roll bursts with flavor   the cesar hand roll is so underrated  so delicious   ill enjoy many more happy hours here,2024-08-31,4.7,Uchi Austin,"801 S Lamar Blvd, Austin, TX 78704, USA",0.9907,Positive
"im not from austin and almost everyone i asked for restaurant recommendations suggested this place i wasnt really sure what to expect so i went for happy hour to catch the vibe ended up ordering maybe 15 dishes incredible quality dont think ive had sashimi this good anywhere but costal towns

our server yumi was an absolute angel impeccable menu knowledge gave us great recommendations give this girl a raise she truly made our experience

absolutely suggest the wagyu carpaccio and  all the nigiri and sashimi we had slapppeddd

the unfiltered sake was so delicate and beautiful bushido sake is dangerously crushable",2024-09-26,4.7,Uchi Austin,"801 S Lamar Blvd, Austin, TX 78704, USA",0.9535,Positive
"lovely sushi place on south congress av huge selection of plates with innovative flavours staff was super helpful and nice trying to help us find the best dishes we tried a selection of different dishes
slightly pricey but definitely worth it",2024-07-18,4.7,Uchi Austin,"801 S Lamar Blvd, Austin, TX 78704, USA",0.9532,Positive
was looking for an impromptu brunch spot with my mom and sister and stumbled across this place superb highly recommend  our server soner was friendly funny and fast he engaged in conversation with us just enough  not pushy or rushed at all the food was excellent great variety of flavors we each ordered something different so we could try the most the atmosphere was bright with plenty of space between tables its casual enough that you can dress up or down we came casual but saw plenty of groups dressed up  celebrating oh and the staff does a cute light show with birthday shots ,2024-08-24,4.2,Taverna Austin,"258 W 2nd St, Austin, TX 78701, USA",0.9759,Positive
pretty good italian took a break from the mexican food lol we went about 7pm on a saturday and there was available seating in the cocktail lounge or outside the main dining area seemed to be for reservations i had the gluten free pasta and my bf had the pizza it looked good,2024-06-23,4.2,Taverna Austin,"258 W 2nd St, Austin, TX 78701, USA",0.9337,Positive
taverna the downtown austin location had great food and wine we went for a birthday celebration and went specifically for the cacio e pepe we started with the frittura mista di mare calamari shrimps vegetables spicy tomato aioli tartar sauce lemon then the cacio which is prepared tableside in a parmesan wheel and had to finish with dessert it was a great evening,2024-08-17,4.2,Taverna Austin,"258 W 2nd St, Austin, TX 78701, USA",0.8779,Positive
