cleaned_review,standardized_date,cleaned_rating,Restaurant,Address,sentiment_score,sentiment
a big surprise to my staying at utexas austin i checked in at the att conference center for a conference and all our meals were served here originally i had no high expectations for hotel meals but i enjoyed every single thing served by carillon the grilled veges pasta grilled ribs grilled chicken fresh salad desserts everything was so healthy tasty and fresh in the morning they open this big breakfast buffet with coffee tea oj all included for 18 i am already considering taking my whole family here for a vacation and stay at att conference center again highly recommended,2024-04-30,4.5,The Carillon,"1900 University Ave, Austin, TX 78705, USA",0.9564,Positive
the food is fantastic specially the steaks we went here to celebrate our wedding anniversary  we chose the 3 course meal and suggest that you also try them from starter main menu and dessert the price isnt that bad depends on what main course you would pick,2024-03-24,4.5,The Carillon,"1900 University Ave, Austin, TX 78705, USA",0.8793,Positive
my mother was visiting me for the first time after moving to austin and i wanted to take her somewhere nice for lunch since im gluten free we planned which day we would go based on the weekly menu thats published for the buffet there isnt the quantity of food that wed typically see at a vegas buffet but the price quality and presentation of the food more than made up for it we ate until we couldnt eat any more the staff was very friendly and the signs clearly posted which items were gluten free i believe theres no parking validation for lunchtime but overall its still cheaper than going to vegas to meet for a buffet lunch,2023-09-07,4.5,The Carillon,"1900 University Ave, Austin, TX 78705, USA",0.9324,Positive
"beautiful atmosphere so we were surprised it was mostly empty for a brunch buffet  especially at a reasonably price as it is  beautiful room and furnishings  lovely

lovely mimosas good coffee a rather sparse buffet of oatmeal pancakes scrambled eggs only not other options sausage bacon potatoes and premade processed syscostyle breads for toasting plain fruit  no desserts or omelettes or anything such as that but that would have been great for mehad the bacon not been literally rancid and the bagels horribly stale

we all noticed the issue with the bacon but i was quite sure they were aware of it because of the issue with the bagels  i grabbed one and it was so hard so stale that i said out loud without realizing it oh my god these are horribly stale we were there right when they opened so they had clearly reused them rather than them being out all day

fortunately a staff member did hear me and asked if i would like a fresh one  she got out the bag to assist me which was very kind  she likely replaced them after that

the eggs were good though not hot  and the potatoes were as well  the items are not served in chafing dishes which may be the cause of the spoiled bacon if they reused it from the day before or god forbid now that i think about it last week  it wasnt a question or a maybe the bacon had gone bad  and it was evident  all food is in cast iron pans not chafers to keep the food fresh and at controlled temperatures

initially our service was great but we waited for 40 minutes after finishing to get our bill  no refills no  checkins   we did have both initially but then all staff were absent and we could not leave my first old plate sat under a new one because there was no service to remove it  by 1130 we wandered around the empty restaurant looking for anyone to help us so that we could leave as two of us had rides waiting  we could not find our waitress still but were assisted by another waiter who went to find her  it was totally empty by that time

i would rather pay double for fresh food and some thought of the offerings such as an eggs benedict or an omelette station or some fresh pastries or desserts or some interesting other offerings like perhaps migasit was so plain so simple and sadly 2 items being reused when they were very bad that we would not return

i take that back i would try cocktails here in the evening because we love the atmosphere but brunch is empty for good reason so each of our table of 8 would need to decline that option",2024-01-29,4.5,The Carillon,"1900 University Ave, Austin, TX 78705, USA",0.9919,Positive
the food has great flavors each dish is wellprepared offering a true taste of texas comfort food the service is outstanding our waitress was really attentive and efficient always ensuring that your dining experience is enjoyable and smooth the experience makes you feel right at home the decor at texas chili parlor is so lively and inviting warranting 5 stars the texan decor creates a cozy and authentic vibe perfect for enjoying a meal with friends or family the ambiance is casual yet energetic making it an ideal spot for both casual dining and special occasions all the neon lights make it so cool to see texas chili parlor offers a delightful dining experience with delicious food stellar service and a vivid atmosphere highly recommended for anyone looking to enjoy a true texas culinary experience,2024-06-17,4.5,Texas Chili Parlor,"1409 Lavaca St, Austin, TX 78701, USA",0.9967,Positive
i have been dying to visit this place for many years was so happy to have the opportunity to this week it exceeded all expectations due to the service daniel provided exceptionally wonderful waiter the nachos were absolutely amazing and the margaritas were strong highly recommend,2024-09-21,4.5,Texas Chili Parlor,"1409 Lavaca St, Austin, TX 78701, USA",0.971,Positive
"good place to eat if youre in the city had chicken enchiladas with chile sauce and enjoyed taste portion and price welled
welcoming staff and quick service walking distance from bullock museum and state capital",2024-06-02,4.5,Texas Chili Parlor,"1409 Lavaca St, Austin, TX 78701, USA",0.8591,Positive
was visiting the state capitol nearby and had to pop in here after reading so much about it the chili was different to what ive had elsewhere but pretty tasty i did expect more depth and punch though loved the old school dive style atmosphere staff were all very friendly and moving fast took a little while for food to come out but no issues at all,2024-04-08,4.5,Texas Chili Parlor,"1409 Lavaca St, Austin, TX 78701, USA",0.9272,Positive
we had a fantastic time at texas chili parlor a great stop just a quick walk from the capitol we sat near a sweet and  regular and had delicious food a mystery person even covered our bill,2024-08-03,4.5,Texas Chili Parlor,"1409 Lavaca St, Austin, TX 78701, USA",0.9217,Positive
the wonderland of groceries i went for a few simple items and it only took a few minutes i have been going to shop here off and on for years and every time i go its always a nice experience the store is always clean and well stocked plenty of open registers and self checkout kiosks the staff is always nice the ladies are always pretty  and the music is relaxing,2024-09-13,4.4,Hancock Center,"1000 E 41st St, Austin, TX 78751, USA",0.9413,Positive
crowded beyond belief  no parking way too many curbside pickup spots day laborers walking as slow as they take to fix a road all spread out so you cant pass them omg that place was annoying  heb food is awesome,2024-08-16,4.4,Hancock Center,"1000 E 41st St, Austin, TX 78751, USA",0.0516,Positive
"hebs really a  healthy choice with  four nutritional food sources that will make shopping habits the first in my shopping cart im very pleased  all the employees members or respectful polite very helpful and fast  i like shopping at hebsubject invitation to participate in google opinion rewards surveys

dear heb hancock center team

i hope this message finds you well

i would like to invite you to participate in google opinion rewards a platform where you can earn rewards by completing short surveys this is a great opportunity to earn passive income while sharing your opinions on various topics

to get started please download the google opinion rewards app using the following link download google opinion rewardshttpsgoogleopinionrewardspagelinkshare

thank you for considering this opportunity if you have any questions or need further information please feel free to reach out

best regards

james jr houston",2024-08-28,4.4,Hancock Center,"1000 E 41st St, Austin, TX 78751, USA",0.9961,Positive
i absolutely love this place i fell in love with trader joes when i lived in houston this is the go to place for organic food and snacks every time i go no matter how many people are in the check out line they will check you out fast they have plenty of workers and cash registers,2024-04-28,4.4,Hancock Center,"1000 E 41st St, Austin, TX 78751, USA",0.8354,Positive
before and after in a three months a great place to work outgod bless 247 fitness,2024-09-20,4.4,Hancock Center,"1000 E 41st St, Austin, TX 78751, USA",0.8402,Positive
"el arroyo is a little tex mex gem in austin
too many fans appreciate its clever signs without stopping in for its great food they seem to be expanding with additional patios which will hopefully bring them even more customers
personally i love their bbq chicken with a frozen margarita and chips  forward by a walk across the street for a beer at the mean eyed cat thats a great austin experience",2024-09-23,4.1,El Arroyo,"1624 W 5th St, Austin, TX 78703, USA",0.9702,Positive
"finally came in for lunch i pass by el arroyo often working in austin very cool austin original and the sign is obviously famous around the internet for its trendy statements

definitely a place to mark off my bucket listi got the fried avocado  plate trudys is famous for the stuffed avocado but el arroyo has it too

too bad i was working and couldnt enjoy some beer and margaritas maybe next time",2024-08-21,4.1,El Arroyo,"1624 W 5th St, Austin, TX 78703, USA",-0.6969,Negative
"nostalgia history and these darn tootin creative signs that change regularly with spontaneous comedic text this place has made a name for itself in memes across the internet and in the hearts of austin

got the queso and a shrimp and crab cream cheese enchilada was pretty delicious actually tasted a bit like crab dip which actually seemed about right after rereading the description on the menu  i dont know that i would order that again because its a lot of the same taste but it was good  perhaps if one were sharing that and something else it would be good to mix and match  that said the plate was big enough to share between two lots of rice and beans and two big enchiladas

the design of the place is pretty cool they have a cut apart school bus outside that is pretty neat  with fun artistic design of the place in general  there is both indoor and outdoor seating the outdoors probably more artistic but ended up sitting inside because it was hot out

you can also kind of gift shop christmas ornaments magnets etc of the oh so famous the sign  the ornaments were about 20 in september of 2024",2024-09-18,4.1,El Arroyo,"1624 W 5th St, Austin, TX 78703, USA",0.9923,Positive
"seat yourself when you walk in food is amazing great flavor all around they dont have fountain drinks they are cans so just be prepared for that
this was our first time and we will definitely be back
there is indoor and outdoor seating
went around 450 on a sunday and was in and out within an hour

seriously cant get over how delicious my meal was i got the santa fe enchiladas with sour cream sauce to die for that flavor is not comparable

bbq chicken i wasnt sold on until i tasted it oh my goodness its delicious

you really cant go wrong with anything you choose

1210 recommend

others with me said
it smacked it was bussin ",2024-02-26,4.1,El Arroyo,"1624 W 5th St, Austin, TX 78703, USA",0.9715,Positive
the people who bring us irreverent social media messaging also cook up some darn great tex mex food in the heart of austin the ground beef taco cheese enchilada chips and salsa passed my tex mex food snob taste test i dropped in because of their advertising but now i must return for the comida also loved their people  will be returning for sure,2024-04-23,4.1,El Arroyo,"1624 W 5th St, Austin, TX 78703, USA",0.8705,Positive
lovely place with really attentive and entertaining staff unfortunately i just really think the menu is not all that good when they bring out tortillas theyre incredibly hard and difficult most of the food is just not convenient to eat and the flavors are not all that great if youre going to do family style make it convenient to portion ceviche was not that great either i get that they are doing their own take on traditional dishes but i just dont think their take is neither tasty nor convenient in the way they prepare and serve it the flavors are also uninspiring some more than others the guacamole was just guacamole but quite expensive this seem to be the recurring theme the dishes were the some of their parts but there was nothing transcendent in terms of flavor about any of it and this is a shame because mexican food really can be done in an upscale way and be amazing just not this chef,2024-09-02,4.2,La Condesa,"400 W 2nd St A, Austin, TX 78701, USA",-0.3386,Negative
"this was our first time at la condesa  we went about 500 pm for happy hour only

we parked in a nearby parking garage as street parking downtown can be difficult

we sat in the bar area and easily found two seats it was a nice setting

the service was excellent and the happy hour special was excellent also

my key fob fell onto the floor while there and they were already closed for the night before i realized it they held it for me until i could get back to town a couple of days later and quickly got it when we came in for it

we want to try the food and we will definitely come back",2024-08-15,4.2,La Condesa,"400 W 2nd St A, Austin, TX 78701, USA",0.9726,Positive
great experience the service was top tier  the food matched it perfectly mexican cuisine that is genuine  not texmex the tortillas are made from corn  the seasoning  spices are fresh please give them a visit if youre ever in austin you will not regret,2024-09-08,4.2,La Condesa,"400 W 2nd St A, Austin, TX 78701, USA",0.9435,Positive
"authentic mexican food in down town restaurant does not have a huge menu but everything we ordered was delicious guacamole came with a few huge chips for dipping we did not ask for more chips nor were we offered it was interesting that other tables got additional chips and we didnt

we had great service and food was delicious even though portions were not big food was still filling and satisfying warm churros were a perfect way to end our dinner",2024-05-21,4.2,La Condesa,"400 W 2nd St A, Austin, TX 78701, USA",0.9622,Positive
really really liked this place the ambiance is so enjoyable its right off of 2nd street so you can see all the lights on the trees theres a parking garage right beside the restaurant on guadalupe street the happy hour menu is amazing half off the entire list of drinks must sit in the bar area for the happy hour more seating in the area than pictured including a small patio they have some amazing tequila options we couldnt believe the complexity and flavor of the el cubico the tacos are authentic with corn tortillas that are smooshed and hand cooked  great place for gf and df very happy with the tacos  thank you luke and staff for the amazing experience,2024-09-20,4.2,La Condesa,"400 W 2nd St A, Austin, TX 78701, USA",0.9908,Positive
cool place use to be great  now they suck this is my monster bowl i havent touched it yet and can see the bottom of the bowl they skimp on everything now  i used to love this place and now its rare that i ever go  come on man load us up on rice and beans at least theyre cheap  this bowl cost me almost 18,2024-02-01,4.4,Freebirds World Burrito,"515 S Congress Ave Ste. 101, Austin, TX 78704, USA",0.8271,Positive
thank you guys  yk who you are this night crew specifically are super great turned my frown upside down for sure the burrito was too good,2024-09-09,4.4,Freebirds World Burrito,"515 S Congress Ave Ste. 101, Austin, TX 78704, USA",0.9403,Positive
i placed an online pickup order for a bowl and a quesadilla  when i arrived back home i noticed my quesadilla did not have any cheese in it whatsoever same with my bowl and was missing the guac   that i paid almost 3 extra for im a die hard freebirds fan but this was an extremely disappointing experience and wont be back anytime soon,2024-01-10,4.4,Freebirds World Burrito,"515 S Congress Ave Ste. 101, Austin, TX 78704, USA",-0.8095,Negative
the service and employees were topnotch and the establishment was spotless while the food was tasty it would have been even better with a bit more meat its starting to feel like freebirds is becoming similar to subway,2024-08-08,4.4,Freebirds World Burrito,"515 S Congress Ave Ste. 101, Austin, TX 78704, USA",0.6597,Positive
nice place to grab quick burrito or a bowl parking spaces are a bit tight but usually there are some spaces available been here a few times and always loved the food quality,2023-03-01,4.4,Freebirds World Burrito,"515 S Congress Ave Ste. 101, Austin, TX 78704, USA",0.8047,Positive
tried the chicken fried pork chop  it was really tasty jalapeno creamed spinach and the okra and tomatoes they were good nice variety of sides to choose from we skipped dessert will be back,2024-09-23,4.1,Hoover's Cooking,"2002 Manor Rd, Austin, TX 78722, USA",0.6908,Positive
great experience with delicious food the staff is wonderful and the atmosphere is welcoming the food is good really good with the chicken as the star of the show there are plenty of dessert options for those with a sweet tooth,2024-06-20,4.1,Hoover's Cooking,"2002 Manor Rd, Austin, TX 78722, USA",0.9726,Positive
"april 2024

hoovers cooking is all about serving the local community with southern comfort food much of which is locally sourced i have dined here before a few times in the past and was excited to return  it is located in an area full of new popular eateries but this place is a landmark there was plenty of parking and was easy to find it is all table seating except a few booths

i noticed the staff took their time to seat and serve you no rushing which made me feel more like being at my parents it was very calm  i also noticed the love rocks tx slogan all over with a huge collection of painted rocks to spread love which remind when i myself painted a rock during covid there was a charm about this place watching an older man painting away

i ordered the 2pc fried chicken dark with 2 house mates macaroni  cheese and green beans and sweet tea from looking around this place it displays local austin history all around including items from the frisco shop once our heavy plates of food arrived the fried chicken looked very good the food was very hot  i tried a chicken leg and the crust was crunchy and tasty  the chicken was also very delicious the mac  cheese was great along with the green beans which had chunks of brisket in it overall it was really good where it was not spicy at all and perfect for older folks really good fried chicken

planning to return to try the fried catfish or bbq chicken",2024-04-07,4.1,Hoover's Cooking,"2002 Manor Rd, Austin, TX 78722, USA",0.9972,Positive
first time here the service was great our waiter was very friendly the chicken and dumplings were very tasty as was the mac and cheese the sweet tea wasnt as sweet as i liked but thats not on them at all prices are very reasonable will definitely be coming back,2024-08-29,4.1,Hoover's Cooking,"2002 Manor Rd, Austin, TX 78722, USA",0.9098,Positive
i have been here three times and it never disappoints great hospitality and wonderful soul food,2024-08-25,4.1,Hoover's Cooking,"2002 Manor Rd, Austin, TX 78722, USA",0.3798,Positive
the fish fajitas here are one of my favorite dishes to eat in austin more people need to get hip to this it is always excellent even after the 10 years ive been eating here everything on the menu is amazing i highly recommend mango margaritas are so worth it my buddy said its the best mexican food hes ever had and hes been all over the world ,2024-07-22,4.2,Polvos,"2004 S 1st St, Austin, TX 78704, USA",0.9637,Positive
"only giving 2 stars for the ambiance and location

service was about as bad as it gets the server was rude and blatantly unfriendly when taking our order rather than explaining what we could get with our chilaquiles he turned his screen around and made us read through the options on his pos system

portion sizes were large but the food wasnt anything special no salsa rojo on chilaquiles is pretty strange margarita was just bad

would not recommend",2024-07-26,4.2,Polvos,"2004 S 1st St, Austin, TX 78704, USA",-0.847,Negative
"food was good margaritas were delish
this place is expensive idk if it was really worth it
there parking lot is not very big so it was a mission to get out parking lot",2024-07-27,4.2,Polvos,"2004 S 1st St, Austin, TX 78704, USA",0.5709,Positive
sooo tasty and great portion sizes there are so many vegetarian options too i got the vegetarian enchilada and taco combo the pickles and salsa is also so delicious i liked the margarita def a lot of alcohol the staff is very nice too and the restaurant is so cute i would love to come back,2024-05-17,4.2,Polvos,"2004 S 1st St, Austin, TX 78704, USA",0.976,Positive
"we came around 7pm on friday and were sat right away

ton of street parking behind

we ordered some queso and got it in less than 5 mins

then ordered the 3 chicken fajita tacos and 3 steak fajita tacos also got the chile rellano with steak

very good quality mexican food and everything was prepared super fast
also have salsa bar with delicious pickled carrots 

total bill for the three dishes was 62

cant wait to dine again",2024-06-30,4.2,Polvos,"2004 S 1st St, Austin, TX 78704, USA",0.9134,Positive
a local tip from the hotel for good burgers wow we were not disappointed i like the atmosphere feels local rather dark in the evening but super cool burgers were great i can only recommend it,2024-09-18,4.5,Casino El Camino,"517 E 6th St, Austin, TX 78701, USA",0.9711,Positive
"service on a sunday afternoon was pretty good food is made fresh and the burgers are worth the hype pretty fairly prices food my girl and i had 3 items totaling 37 before tip

atmosphere could be better but its officially a bar everything in here is dark and somewhat goth or metal themed

i would certainly back again the decor wouldnt keep me away nor should other people avoid it for the divebar style they are known for",2024-09-08,4.5,Casino El Camino,"517 E 6th St, Austin, TX 78701, USA",0.8176,Positive
after hearing from a bartender at another place i wanted to check it out i looked at reviews knew what to expect and the place is how it was described  i liked the vibe here loud music cool wall hangings i ordered a beer and the staff told me how the food ordering works i got the chicago burger and fries the burger was made just how the menu describes it medium  it was absolutely great  i know where to go for a burger next time im in town,2024-07-23,4.5,Casino El Camino,"517 E 6th St, Austin, TX 78701, USA",0.8588,Positive
overall this is a unique space but then it is austin the burger and chili cheese fries are amazing the burger had great favor and the fries hit the spot the ppl welcomed us and made service easy this place may be a bar but put bar food on the next level,2024-09-02,4.5,Casino El Camino,"517 E 6th St, Austin, TX 78701, USA",0.9731,Positive
are you kidding me this place had the music blaring it was super dark in here and it was amazing 10 out of 10 recommend the guys were the sweetest aka the staff the food was to die for it was the kind of place you dont want to miss out on dont let the atmosphere fool you walk in order sit down and enjoy ,2024-06-06,4.5,Casino El Camino,"517 E 6th St, Austin, TX 78701, USA",0.8032,Positive
been going here for quite awhile live close by usually fairly happy with the product but it seems to have waned recently was fairly soggy and there must be a pepperoni shortage i dont know about just expect a little more for the price service was great tho very kind lady at the front,2024-05-20,4.4,East Side Pies,"1401 Rosewood Ave, Austin, TX 78702, USA",0.9107,Positive
the pizza had a delicious flavor but the crust wasnt as crispy as i prefer overall it was a good experience and the friendly staff made up for it,2024-07-10,4.4,East Side Pies,"1401 Rosewood Ave, Austin, TX 78702, USA",0.8885,Positive
"ordered a pepperoni the slice had just 2 pieces of pepperoni would rather have picked up a cheese pizza slice

i asked for ketchup chilly saucemustard was asked to take it from the restaurant next door which was rather strange

one of those places where you feel
why i should i leave a tip ",2024-08-10,4.4,East Side Pies,"1401 Rosewood Ave, Austin, TX 78702, USA",-0.25,Negative
pizza was very tasty  crust was perfectly thin and crispy had jamaican pizza with jerk chicken and jalapeos which i could have done with less no inside seating but does have picnic tables 18 bucks for a 10 in so be ready for that,2023-02-12,4.4,East Side Pies,"1401 Rosewood Ave, Austin, TX 78702, USA",0.6266,Positive
bought three slices for lunch i asked for a box for my three slices and the guy at the counter refused to help me out after giving him a healthy tip no thanks or show of appreciation instead he puts my pizza on a cheap flimsy plate wrapped in foil and all three slices stacked up on top of each other the cheese was all stuck on the foil and was the soggiest pizza ive ever had the flavor was good but the counter guy ruined everything i will never go back they wont get my business ever again,2024-06-05,4.4,East Side Pies,"1401 Rosewood Ave, Austin, TX 78702, USA",0.25,Positive
